{
  "schema": "idc.security-evidence/v2",
  "releaseRevision": "26b9285c1fe11a3ef875a34ff30faa0275eddf24",
  "sourceBundle": {
    "path": "source/kimi/KIMI-K3-IDC-SKILLS-2.0.3-PENTEST.tar.gz",
    "sha256": "6b471d41a3d7adec021690ceb007e949140ec05061a165674709d6511628e81d"
  },
  "sourceRoster": {
    "path": "source/kimi/round3-calibration.md",
    "sha256": "93c5d36e266698dda592c834082cba6113570e3e8898eee7bc35c9dfffb8df25"
  },
  "expectedFindingIds": [
    "K3-203-001",
    "K3-203-002",
    "K3-203-003",
    "K3-203-004",
    "K3-203-005",
    "K3-203-006",
    "K3-203-007",
    "K3-203-008",
    "K3-203-009",
    "K3-203-010",
    "K3-203-011",
    "K3-203-012",
    "K3-203-013",
    "K3-203-014",
    "K3-203-015",
    "K3-203-016",
    "K3-203-017",
    "K3-203-018",
    "K3-203-019",
    "K3-203-020",
    "K3-203-021",
    "K3-203-022",
    "K3-203-023",
    "K3-203-024",
    "K3-203-025",
    "K3-203-026",
    "K3-203-027",
    "K3-203-028",
    "K3-203-029",
    "K3-203-030",
    "K3-203-031"
  ],
  "findings": [
    {
      "id": "K3-203-001",
      "title": "In-band first-contact trust anchors permit a fully self-consistent forged release",
      "sourceLocations": [
        {
          "revision": "26b9285c1fe11a3ef875a34ff30faa0275eddf24",
          "path": "integrity/README.md",
          "startLine": 14,
          "endLine": 18
        }
      ],
      "fixture": {
        "anchor": "candidate-preserved",
        "path": "source/kimi/lanes/evidence/K3-0-challenge-c1/forged-install.json",
        "sha256": "cd200c5a11e2ff000c02e06bb763cc7e747273c23af3967580a087a5355d6127"
      },
      "capture": {
        "kind": "preserved-observation",
        "source": {
          "type": "local",
          "path": "source/kimi/lanes/evidence/K3-0-challenge-c1/genuine-vs-forged.json"
        },
        "sha256": "71f3e48539756d589de9e901cd85dfac4ba8ecf66c1a1afc7c783114faa70477",
        "fixtureSha256": "cd200c5a11e2ff000c02e06bb763cc7e747273c23af3967580a087a5355d6127"
      },
      "semanticBinding": {
        "description": "The listed exact sentinel occurs in the named preserved UTF-8 bytes; this is byte emission, not a claim that a command was executed.",
        "assertions": [
          {
            "target": "capture",
            "contains": "public-key fingerprint mismatch"
          }
        ]
      },
      "discriminator": {
        "description": "The release source range resolves, the candidate-preserved fixture and preserved capture digest-match, and each semantic sentinel is present. Candidate regression tests are separate downstream gates.",
        "passed": true
      },
      "disposition": {
        "status": "confirmed",
        "rationale": "Two independent Kimi forgeries reached attacker-controlled authority when the first trust value was learned in-band; a genuinely pinned launcher rejected them."
      }
    },
    {
      "id": "K3-203-002",
      "title": "Attached or mid-command redirection bypasses guarded Git subcommands",
      "sourceLocations": [
        {
          "revision": "26b9285c1fe11a3ef875a34ff30faa0275eddf24",
          "path": "skills/agent-guardrails/scripts/block-dangerous-git.sh",
          "startLine": 165,
          "endLine": 170
        }
      ],
      "fixture": {
        "anchor": "candidate-preserved",
        "path": "source/kimi/lanes/evidence/K3-8-p2-gitguard/verdicts.txt",
        "sha256": "907bb202ec72a85f4b53aec1a7b00a53e52352ea5bea7989225d52e7bf4e95ae"
      },
      "capture": {
        "kind": "preserved-observation",
        "source": {
          "type": "local",
          "path": "source/kimi/lanes/evidence/K3-4-redir/proofs.txt"
        },
        "sha256": "8bd4eddbf3e5446e99fb285470b91202f81c2e545609c32c0831ff79a341514b",
        "fixtureSha256": "907bb202ec72a85f4b53aec1a7b00a53e52352ea5bea7989225d52e7bf4e95ae"
      },
      "semanticBinding": {
        "description": "The listed exact sentinel occurs in the named preserved UTF-8 bytes; this is byte emission, not a claim that a command was executed.",
        "assertions": [
          {
            "target": "capture",
            "contains": "EXECUTED=YES"
          }
        ]
      },
      "discriminator": {
        "description": "The release source range resolves, the candidate-preserved fixture and preserved capture digest-match, and each semantic sentinel is present. Candidate regression tests are separate downstream gates.",
        "passed": true
      },
      "disposition": {
        "status": "confirmed",
        "rationale": "The preserved guard verdicts and real-Git proofs show dangerous operations executed while the 2.0.3 classifier allowed them."
      }
    },
    {
      "id": "K3-203-003",
      "title": "Invoked bang alias composes with call-site arguments",
      "sourceLocations": [
        {
          "revision": "26b9285c1fe11a3ef875a34ff30faa0275eddf24",
          "path": "skills/agent-guardrails/scripts/block-dangerous-git.sh",
          "startLine": 1058,
          "endLine": 1092
        }
      ],
      "fixture": {
        "anchor": "candidate-preserved",
        "path": "source/kimi/lanes/evidence/K3-8-p2-gitguard/verdicts.txt",
        "sha256": "907bb202ec72a85f4b53aec1a7b00a53e52352ea5bea7989225d52e7bf4e95ae"
      },
      "capture": {
        "kind": "preserved-observation",
        "source": {
          "type": "local",
          "path": "source/kimi/lanes/evidence/K3-4-bangargs/proofs.txt"
        },
        "sha256": "f2b9d1cf82a32af8489b783d3fb3f60bd3040fdb4ad6b69c2b6a9be898916913",
        "fixtureSha256": "907bb202ec72a85f4b53aec1a7b00a53e52352ea5bea7989225d52e7bf4e95ae"
      },
      "semanticBinding": {
        "description": "The listed exact sentinel occurs in the named preserved UTF-8 bytes; this is byte emission, not a claim that a command was executed.",
        "assertions": [
          {
            "target": "capture",
            "contains": "bang-alias call-site args"
          }
        ]
      },
      "discriminator": {
        "description": "The release source range resolves, the candidate-preserved fixture and preserved capture digest-match, and each semantic sentinel is present. Candidate regression tests are separate downstream gates.",
        "passed": true
      },
      "disposition": {
        "status": "confirmed",
        "rationale": "The 2.0.3 alias model discarded decisive call-site arguments; the preserved proof demonstrates the composed Git execution."
      }
    },
    {
      "id": "K3-203-004",
      "title": "A leading data or blob candidate suppresses later external candidates",
      "sourceLocations": [
        {
          "revision": "26b9285c1fe11a3ef875a34ff30faa0275eddf24",
          "path": "skills/self-contained-ship/scripts/scan-egress.sh",
          "startLine": 2518,
          "endLine": 2528
        }
      ],
      "fixture": {
        "anchor": "candidate-preserved",
        "path": "source/kimi/lanes/evidence/K3-5-c1-srcset/fixture.html",
        "sha256": "f04479757f2fafe534974b206c66b496ba9850a3449ecf9f7940687d3cc8661d"
      },
      "capture": {
        "kind": "preserved-observation",
        "source": {
          "type": "local",
          "path": "source/kimi/lanes/evidence/K3-5-c1-srcset/scan.out"
        },
        "sha256": "f9b42245cdb18665ebd7466c720743a0df886c85440e0ba973f56abec892f15d",
        "fixtureSha256": "f04479757f2fafe534974b206c66b496ba9850a3449ecf9f7940687d3cc8661d"
      },
      "semanticBinding": {
        "description": "The listed exact sentinel occurs in the named preserved UTF-8 bytes; this is byte emission, not a claim that a command was executed.",
        "assertions": [
          {
            "target": "capture",
            "contains": "scan-egress: PASS"
          },
          {
            "target": "fixture",
            "contains": "srcset-leak.png"
          }
        ]
      },
      "discriminator": {
        "description": "The release source range resolves, the candidate-preserved fixture and preserved capture digest-match, and each semantic sentinel is present. Candidate regression tests are separate downstream gates.",
        "passed": true
      },
      "disposition": {
        "status": "confirmed",
        "rationale": "The exact scanner-green fixture and Chromium request log demonstrate later srcset/imagesrcset/ping candidates were live."
      }
    },
    {
      "id": "K3-203-005",
      "title": "Bare semicolon meta refresh network paths are missed",
      "sourceLocations": [
        {
          "revision": "26b9285c1fe11a3ef875a34ff30faa0275eddf24",
          "path": "skills/self-contained-ship/scripts/scan-egress.sh",
          "startLine": 2951,
          "endLine": 2960
        }
      ],
      "fixture": {
        "anchor": "candidate-preserved",
        "path": "source/kimi/lanes/evidence/K3-5-c2-meta/m.html",
        "sha256": "add539e1a31b4480f7e3c7a909a2df6181ddef04e060969b2a9c13aeac2d7a7d"
      },
      "capture": {
        "kind": "preserved-observation",
        "source": {
          "type": "local",
          "path": "source/kimi/lanes/evidence/K3-5-c2-meta/scan.out"
        },
        "sha256": "f9b42245cdb18665ebd7466c720743a0df886c85440e0ba973f56abec892f15d",
        "fixtureSha256": "add539e1a31b4480f7e3c7a909a2df6181ddef04e060969b2a9c13aeac2d7a7d"
      },
      "semanticBinding": {
        "description": "The listed exact sentinel occurs in the named preserved UTF-8 bytes; this is byte emission, not a claim that a command was executed.",
        "assertions": [
          {
            "target": "capture",
            "contains": "scan-egress: PASS"
          },
          {
            "target": "fixture",
            "contains": "meta-bare"
          }
        ]
      },
      "discriminator": {